{
  "schema_version": "1.2",
  "status": "READY_FOR_EXTERNAL_COLLABORATOR",
  "target_repository": "Ngh1aa/uiux-ai-workspace",
  "task": "Implement five skill-library upgrades: correct UX knowledge, deepen existing domain profiles, add annotated design examples, run controlled skill evaluations, add practice and critique exercises; diagnose and fix workflow defects. No commit push merge or deploy.",
  "authority": "branch_write",
  "task_contract": {
    "intent": "fix",
    "website_type": "generic",
    "domain": "generic",
    "product_archetype": "generic",
    "validation_lane": "prototype",
    "mode": "interactive-prototype",
    "risk": "standard",
    "features": [
      "skill-library-maintenance"
    ],
    "scope": [],
    "change_surface": "FOCUSED",
    "preserve": [],
    "forbidden": [],
    "references": [],
    "authority": "branch_write",
    "platform_family": "web",
    "target_platforms": [],
    "implementation_stack": "unknown",
    "requested_output": "application",
    "task_contract_version": "1.0",
    "delivery": {
      "policy": "adaptive-prompt-os-v4",
      "lane": "full_prompt_os"
    },
    "inference": {
      "confidence": 0.65,
      "evidence": [
        "intent:fix",
        "change_surface:FOCUSED",
        "authority:branch_write",
        "feature:skill-library-maintenance",
        "mode:interactive-prototype",
        "risk:standard",
        "validation_lane:prototype",
        "delivery_policy:adaptive-prompt-os-v4",
        "delivery_lane:full_prompt_os"
      ],
      "routing_status": "resolved",
      "candidate_domains": [],
      "resolution_source": "canonical"
    },
    "target_truth": {
      "status": "NO_USABLE_TRUTH",
      "target_root": "C:\\Users\\LENOVO\\Documents\\Codex\\2026-10-22\\https-github-com-ngh1aa-uiux-ai\\work\\uiux-ai-workspace",
      "fields": {},
      "provenance": {},
      "sources": [
        "README.md"
      ],
      "diagnostics": []
    },
    "routing_provenance": {
      "precedence": [
        "explicit_override",
        "target_project_truth",
        "goal_inference"
      ],
      "field_sources": {
        "website_type": "goal_inference",
        "domain": "goal_inference",
        "product_archetype": "goal_inference",
        "validation_lane": "goal_inference",
        "mode": "goal_inference",
        "risk": "goal_inference",
        "features": "goal_inference",
        "platform_family": "goal_inference",
        "target_platforms": "goal_inference",
        "implementation_stack": "goal_inference",
        "requested_output": "goal_inference"
      },
      "explicit_override_fields": [],
      "derived_fields": {},
      "merge_diagnostics": [],
      "target_truth_applied_before_flow_resolution": true
    },
    "requested_authority": "branch_write",
    "effective_authority": "branch_write"
  },
  "resolved_flow": {
    "id": "skill-library-maintenance",
    "source": "skills_UIUX/flows/skill-library-maintenance.json",
    "score": 144,
    "stages": [
      {
        "id": "research",
        "agent": "research",
        "purpose": "Inspect capability owners, primary sources and reproducible workflow defects.",
        "skills": [
          "project-context",
          "adaptive-skill-routing-and-context-budget",
          "skill-authoring-and-governance",
          "ui-improvement"
        ],
        "mandatory_skills": [
          "project-context",
          "adaptive-skill-routing-and-context-budget",
          "skill-authoring-and-governance"
        ],
        "jit_skills": [
          "ui-improvement"
        ],
        "jit_skill_sources": {
          "ui-improvement": "conditional"
        },
        "gates": [
          {
            "id": "maintenance-scope",
            "require": "Existing owners, knowledge gaps, source scope and regression reproduction are explicit"
          }
        ]
      },
      {
        "id": "implementation",
        "agent": "implementation",
        "purpose": "Extend existing skills and runtime owners without creating a parallel workflow.",
        "skills": [
          "project-context",
          "ai-agent-coding-guardrails",
          "skill-authoring-and-governance",
          "agent-evaluation-and-reliability",
          "ui-improvement"
        ],
        "mandatory_skills": [
          "project-context",
          "ai-agent-coding-guardrails",
          "skill-authoring-and-governance",
          "agent-evaluation-and-reliability"
        ],
        "jit_skills": [
          "ui-improvement"
        ],
        "jit_skill_sources": {
          "ui-improvement": "conditional"
        },
        "gates": [
          {
            "id": "capability-change",
            "require": "Changed knowledge and behavior have relevant source, data, negative-case and outcome verification"
          }
        ]
      },
      {
        "id": "qa",
        "agent": "qa",
        "purpose": "Verify routing, knowledge integrity and eval records; separate technical checks from design or human outcomes.",
        "skills": [
          "testing-strategy",
          "agent-evaluation-and-reliability",
          "skill-authoring-and-governance"
        ],
        "mandatory_skills": [
          "testing-strategy",
          "agent-evaluation-and-reliability",
          "skill-authoring-and-governance"
        ],
        "jit_skills": [],
        "jit_skill_sources": {},
        "gates": [
          {
            "id": "maintenance-verification",
            "require": "Structural validators and relevant regressions pass; outcome trials and actual specimen renders are inspected where claimed; unavailable human evidence remains UNKNOWN"
          }
        ]
      }
    ],
    "replanning": {
      "max_replans": 2,
      "triggers": [
        "GATE_FAIL",
        "INVALID_ASSUMPTION",
        "TOOL_FAILURE"
      ],
      "policies": [
        {
          "when": {
            "signal": "GATE_FAIL",
            "current_stage": "qa"
          },
          "reason": "Repair the demonstrated owning knowledge/runtime defect.",
          "target_stage": "implementation"
        },
        {
          "when": {
            "signal": "INVALID_ASSUMPTION"
          },
          "reason": "Reinspect the source and capability boundary.",
          "target_stage": "research"
        }
      ]
    },
    "revision": 0,
    "replan_history": []
  },
  "stages": [
    {
      "id": "research",
      "agent": "research",
      "purpose": "Inspect capability owners, primary sources and reproducible workflow defects.",
      "skills": [
        "project-context",
        "adaptive-skill-routing-and-context-budget",
        "skill-authoring-and-governance",
        "ui-improvement"
      ],
      "mandatory_skills": [
        "project-context",
        "adaptive-skill-routing-and-context-budget",
        "skill-authoring-and-governance"
      ],
      "jit_skills": [
        "ui-improvement"
      ],
      "skill_paths": [
        "skills_UIUX/project-context/SKILL.md",
        "skills_UIUX/adaptive-skill-routing-and-context-budget/SKILL.md",
        "skills_UIUX/skill-authoring-and-governance/SKILL.md",
        "skills_UIUX/ui-improvement/SKILL.md"
      ],
      "gates": [
        {
          "id": "maintenance-scope",
          "require": "Existing owners, knowledge gaps, source scope and regression reproduction are explicit"
        }
      ],
      "design_workflow": {
        "active": false,
        "decision_contract_required": false,
        "ux_contract_required": false,
        "required_check_phases": [],
        "knowledge_source": null,
        "lookup_tool": null,
        "lookup_argv_template": null,
        "check_tool": null,
        "checker": null,
        "contract_output": null,
        "contract_version": null,
        "comparison_tool": null,
        "comparison_protocol": null,
        "sequence": [],
        "ux_first": null,
        "structural_rule": null,
        "authority_effect": "none",
        "gate_effect": "none",
        "evidence_effect": "none",
        "aesthetic_quality": "UNKNOWN"
      },
      "delivery_workflow": {
        "active": false,
        "stage": "research",
        "reason": "Bounded change: use the resolved Flow and existing project artifacts, not a whole-site deliverable set."
      },
      "load_policy": "Load only this stage's routed skills plus target-project evidence needed for the active decision."
    },
    {
      "id": "implementation",
      "agent": "implementation",
      "purpose": "Extend existing skills and runtime owners without creating a parallel workflow.",
      "skills": [
        "project-context",
        "ai-agent-coding-guardrails",
        "skill-authoring-and-governance",
        "agent-evaluation-and-reliability",
        "ui-improvement"
      ],
      "mandatory_skills": [
        "project-context",
        "ai-agent-coding-guardrails",
        "skill-authoring-and-governance",
        "agent-evaluation-and-reliability"
      ],
      "jit_skills": [
        "ui-improvement"
      ],
      "skill_paths": [
        "skills_UIUX/project-context/SKILL.md",
        "skills_UIUX/ai-agent-coding-guardrails/SKILL.md",
        "skills_UIUX/skill-authoring-and-governance/SKILL.md",
        "skills_UIUX/agent-evaluation-and-reliability/SKILL.md",
        "skills_UIUX/ui-improvement/SKILL.md"
      ],
      "gates": [
        {
          "id": "capability-change",
          "require": "Changed knowledge and behavior have relevant source, data, negative-case and outcome verification"
        }
      ],
      "design_workflow": {
        "active": false,
        "decision_contract_required": false,
        "ux_contract_required": false,
        "required_check_phases": [],
        "knowledge_source": null,
        "lookup_tool": null,
        "lookup_argv_template": null,
        "check_tool": null,
        "checker": null,
        "contract_output": null,
        "contract_version": null,